{
  "org": {
    "bin": "104332181962",
    "name": "Тест Оргэнизейшн ТОО"
  },
  "period": {
    "year": "2026",
    "half": "2"
  },
  "income_tenge": "500 000,00",
  "rate_percent": "3",
  "tax_tenge": "15 000,00",
  "tax_words": "Пятнадцать тысяч тенге 00 тиын",
  "signed_on": "14.08.2026",
  "director": "100% & \"итог\" #3 _над_ {скобка} \\слэш $7 ^степень ~волна <знак>",
  "accountant": "Бухгалтеров Б.Б."
}
