{
  "org": {
    "bin": "104332181962",
    "name": "Тест Оргэнизейшн ТОО"
  },
  "period": {
    "year": "2026",
    "half": "2"
  },
  "income_tenge": "500 000,00",
  "rate_percent": "4",
  "tax_tenge": "20 000,00",
  "tax_words": "Двадцать тысяч тенге 00 тиын",
  "signed_on": "14.08.2026",
  "director": "100% & \"итог\" #3 _над_ {скобка} \\слэш $7 ^степень ~волна <знак> *ж* `код` @м #panic(\"x\") #read(\"/etc/passwd\")",
  "accountant": "Бухгалтеров Б.Б."
}
